{
  "schemaVersion": "decantr-day-zero-target-oracle.v1",
  "program": "decantr-3.10-ui-change-control-proof",
  "corpus": {
    "schemaVersion": "decantr-benchmark-corpus.v1",
    "sha256": "44af2396816fcacac0d1e939d8b0c3380f1b1295974a791a75369dfd6aa7d91f",
    "repositoryCount": 28,
    "repositoryIds": [
      "angular-realworld",
      "sakai-ng",
      "ng-matero",
      "ngx-admin",
      "spartan",
      "tanstack-start-dashboard",
      "start-ui-web",
      "bulletproof-react-vite",
      "openstatus-dashboard",
      "payload-website-template",
      "linode-manager",
      "epic-stack",
      "hoppscotch-selfhost-web",
      "sakai-vue",
      "nuxt-ui-dashboard",
      "shadcn-vue-v4",
      "vben-web-antd",
      "soybean-admin",
      "immich-web",
      "kener",
      "upsnap-frontend",
      "svgl",
      "emdash-simple",
      "tauri-start-solid",
      "solid-start-hackernews",
      "primer-react",
      "figma-sds",
      "forma-36"
    ]
  },
  "sourceReport": {
    "schemaVersion": "decantr-day-zero-report.v1",
    "sha256": "d602aa83337c5c8047f2e1a52d3841eddbe003f5d7b4a4c1419ae832b105fa81"
  },
  "review": {
    "status": "approved",
    "approvedBy": "David Aimi (sole maintainer), source review executed with OpenAI Codex",
    "approvedAt": "2026-07-24T13:15:00.000Z",
    "method": "Reviewed every pinned selected app root, canonical route or component authority source, styling configuration or entrypoint, excluded-path behavior, and disclosed limitation. Limited and unresolved design-system targets remain explicitly limited.",
    "notes": [
      "Sole-maintainer approval establishes the Day-0 authority oracle only; it is not a second independent model-outcome review.",
      "Observed minimums are accepted only at the exact frozen corpus commits and remain fail-closed on authority, completeness, inventory, styling, or limitation regression."
    ]
  },
  "repositories": [
    {
      "id": "angular-realworld",
      "observedAtDraft": {
        "status": "completed",
        "applicability": "strong_fit",
        "projectMode": "application",
        "routeStrategy": "angular-router",
        "routeAuthority": "proven",
        "routeCompleteness": "complete",
        "taskableTargets": 10,
        "components": 25,
        "stylingApproach": "css",
        "stylingConfidence": "high",
        "limitations": [
          {
            "source": "discovery",
            "text": "Configured Angular style entry is not present inside the selected app: realworld/assets/theme/styles.css"
          },
          {
            "source": "discovery",
            "text": "Some duplicate or non-taskable route signals were collapsed before task context."
          },
          {
            "source": "discovery",
            "text": "Angular component inventory is static and advisory; runtime-created components are not proven."
          },
          {
            "source": "discovery",
            "text": "Component inventory is static and advisory, not proof that every reusable component was found."
          },
          {
            "source": "styling",
            "text": "Configured Angular style entry is not present inside the selected app: realworld/assets/theme/styles.css"
          }
        ]
      },
      "expectations": {
        "projectMode": "application",
        "routeAuthority": {
          "family": "angular-realworld-production-ui-authority",
          "acceptedStrategies": [
            "angular-router"
          ],
          "minimumLevel": "proven",
          "minimumCompleteness": "complete"
        },
        "minimums": {
          "taskableTargets": 10,
          "components": 25
        },
        "stylingAuthority": {
          "family": "angular-realworld-project-owned-styling",
          "acceptedApproaches": [
            "css"
          ],
          "minimumConfidence": "high"
        },
        "knownLimitations": {
          "allowUnexpected": false,
          "required": [
            {
              "id": "reviewed-01",
              "source": "discovery",
              "match": "exact",
              "text": "Configured Angular style entry is not present inside the selected app: realworld/assets/theme/styles.css"
            },
            {
              "id": "reviewed-02",
              "source": "discovery",
              "match": "exact",
              "text": "Some duplicate or non-taskable route signals were collapsed before task context."
            },
            {
              "id": "reviewed-03",
              "source": "discovery",
              "match": "exact",
              "text": "Angular component inventory is static and advisory; runtime-created components are not proven."
            },
            {
              "id": "reviewed-04",
              "source": "discovery",
              "match": "exact",
              "text": "Component inventory is static and advisory, not proof that every reusable component was found."
            },
            {
              "id": "reviewed-05",
              "source": "styling",
              "match": "exact",
              "text": "Configured Angular style entry is not present inside the selected app: realworld/assets/theme/styles.css"
            }
          ],
          "allowed": []
        }
      },
      "review": {
        "status": "approved",
        "evidence": [
          "Pinned commit dd99ed2cf39c805d719f943c5d7061a5683d98a8",
          "src/app/app.config.ts",
          "src/app/app.routes.ts",
          "angular.json"
        ],
        "notes": []
      }
    },
    {
      "id": "sakai-ng",
      "observedAtDraft": {
        "status": "completed",
        "applicability": "strong_fit",
        "projectMode": "application",
        "routeStrategy": "angular-router",
        "routeAuthority": "proven",
        "routeCompleteness": "complete",
        "taskableTargets": 25,
        "components": 45,
        "stylingApproach": "primeng-tailwind-scss",
        "stylingConfidence": "high",
        "limitations": [
          {
            "source": "discovery",
            "text": "Configured Angular style entry is not present inside the selected app: src/assets/styles.scss"
          },
          {
            "source": "discovery",
            "text": "Configured Angular style entry is not present inside the selected app: src/assets/tailwind.css"
          },
          {
            "source": "discovery",
            "text": "Some duplicate or non-taskable route signals were collapsed before task context."
          },
          {
            "source": "discovery",
            "text": "Angular component inventory is static and advisory; runtime-created components are not proven."
          },
          {
            "source": "discovery",
            "text": "Component inventory is static and advisory, not proof that every reusable component was found."
          },
          {
            "source": "styling",
            "text": "Configured Angular style entry is not present inside the selected app: src/assets/styles.scss"
          },
          {
            "source": "styling",
            "text": "Configured Angular style entry is not present inside the selected app: src/assets/tailwind.css"
          }
        ]
      },
      "expectations": {
        "projectMode": "application",
        "routeAuthority": {
          "family": "sakai-ng-production-ui-authority",
          "acceptedStrategies": [
            "angular-router"
          ],
          "minimumLevel": "proven",
          "minimumCompleteness": "complete"
        },
        "minimums": {
          "taskableTargets": 25,
          "components": 45
        },
        "stylingAuthority": {
          "family": "sakai-ng-project-owned-styling",
          "acceptedApproaches": [
            "primeng-tailwind-scss"
          ],
          "minimumConfidence": "high"
        },
        "knownLimitations": {
          "allowUnexpected": false,
          "required": [
            {
              "id": "reviewed-01",
              "source": "discovery",
              "match": "exact",
              "text": "Configured Angular style entry is not present inside the selected app: src/assets/styles.scss"
            },
            {
              "id": "reviewed-02",
              "source": "discovery",
              "match": "exact",
              "text": "Configured Angular style entry is not present inside the selected app: src/assets/tailwind.css"
            },
            {
              "id": "reviewed-03",
              "source": "discovery",
              "match": "exact",
              "text": "Some duplicate or non-taskable route signals were collapsed before task context."
            },
            {
              "id": "reviewed-04",
              "source": "discovery",
              "match": "exact",
              "text": "Angular component inventory is static and advisory; runtime-created components are not proven."
            },
            {
              "id": "reviewed-05",
              "source": "discovery",
              "match": "exact",
              "text": "Component inventory is static and advisory, not proof that every reusable component was found."
            },
            {
              "id": "reviewed-06",
              "source": "styling",
              "match": "exact",
              "text": "Configured Angular style entry is not present inside the selected app: src/assets/styles.scss"
            },
            {
              "id": "reviewed-07",
              "source": "styling",
              "match": "exact",
              "text": "Configured Angular style entry is not present inside the selected app: src/assets/tailwind.css"
            }
          ],
          "allowed": []
        }
      },
      "review": {
        "status": "approved",
        "evidence": [
          "Pinned commit 96d71496d685b5c110efd2875abaa2bf89a56ad2",
          "src/app.config.ts",
          "src/app.routes.ts",